{
  "artifact_id": "SPEC-ARTIFACTS-001",
  "format": "codearbiter.artifact",
  "format_version": "0.1.0",
  "governance": {
    "approvals": [],
    "review_notes": [
      "Second-pass author review corrected schema, execution-scope, evidence-fingerprint, read-validation and farm-binding defects. No user approval, independent implementation review, or runtime acceptance is recorded."
    ],
    "state": "draft"
  },
  "integrity": {
    "model_sha256": "9bbd7d30fdbeacc151c3ab2c803121ae73974743b975c23de520537592d61d90",
    "normative_sha256": "60e252e63b6310b8748337b7dba9530bff62209b30dd3ae0f905027e6e48bb92",
    "symbol_count": 174
  },
  "kind": "spec",
  "normative": {
    "approach": {
      "binding_decision_refs": [
        "DEC-01",
        "DEC-02",
        "DEC-03",
        "DEC-04",
        "DEC-10",
        "DEC-11"
      ],
      "choice": "Use one file-based Go engine with separate typed spec and plan schemas, one authoritative embedded model per HTML file, deterministic rendering, and existing governed execution interfaces.",
      "id": "APPROACH-01",
      "tradeoff": "Adds binary packaging and format-aware consumers, but removes free-form HTML construction and duplicated criteria identities. No database or always-registered tools are added."
    },
    "baseline": {
      "commit": "45a17319f9ffda327cbdf3f3d40849bae8e920c0",
      "observed_date": "2026-09-14",
      "repository": "https://github.com/arbiterForge/codeArbiter"
    },
    "constraints": [
      {
        "applies_to": [
          "all"
        ],
        "id": "CONSTRAINT-01",
        "source_refs": [
          "SRC-21"
        ],
        "statement": "Use existing public commands, skills and agents. The helper is internal machinery; do not add registrations or startup schema dumps."
      },
      {
        "applies_to": [
          "all"
        ],
        "id": "CONSTRAINT-02",
        "source_refs": [
          "SRC-06",
          "SRC-21"
        ],
        "statement": "Specs and feature implementation plans ship together. Preserve existing authorization, TDD and quality-review authority; allow explicitly defined provisional same-scope dependencies without premature acceptance."
      },
      {
        "applies_to": [
          "all"
        ],
        "id": "CONSTRAINT-03",
        "source_refs": [
          "SRC-14"
        ],
        "statement": "Artifact content is untrusted data. The helper never runs a stored command; hash consistency is not approval authentication."
      }
    ],
    "criteria": [
      {
        "applicability": {
          "mode": "conditional",
          "rationale": "The trigger and stated conditions delimit this obligation; input validation and failure behavior remain part of the contract where applicable."
        },
        "constraint_refs": [
          "CONSTRAINT-01",
          "CONSTRAINT-02",
          "CONSTRAINT-03"
        ],
        "guarantees": [
          "Existing workflows use a shared on-demand leaf and the existing governed execution tool.",
          "No schema, complete document or binary command catalog is inserted into startup/system context."
        ],
        "id": "AC-001",
        "intent_refs": [
          "SCOPE-03"
        ],
        "kind": "behavior",
        "obligation": "must",
        "preconditions": [
          "The baseline host catalogs are captured."
        ],
        "scenarios": [
          {
            "given": "Baseline and candidate generated host surfaces.",
            "id": "SCN-001-01",
            "then": "Zero new discovery entries; no eager schema/body injection.",
            "when": "Compare command/agent/tool IDs and startup payload fixtures."
          },
          {
            "given": "A fixture adds /ca:spec or an always-loaded artifact tool.",
            "id": "SCN-001-02",
            "then": "The gate fails and names the added entry.",
            "when": "Run the surface gate."
          }
        ],
        "source_refs": [
          "SRC-04",
          "SRC-14"
        ],
        "statement": "When the artifact capability is installed, existing public command, agent, top-level skill and persistent tool registrations shall gain no new entries.",
        "title": "No additional discovery surface",
        "trigger": "Build and load each host package.",
        "verification": {
          "evidence_state": "planned",
          "id": "VER-001",
          "method": "automated_and_review",
          "negative_control": "An added convenience command must not be hidden by renaming or filtering it from the comparison.",
          "oracle": "Compare normalized registration sets and startup fixtures, not a claimed token count. Inspect active-routine loading separately.",
          "planned_target": "test_artifact_surface.py::test_no_added_discovery"
        }
      },
      {
        "applicability": {
          "mode": "conditional",
          "rationale": "The trigger and stated conditions delimit this obligation; input validation and failure behavior remain part of the contract where applicable."
        },
        "constraint_refs": [
          "CONSTRAINT-01",
          "CONSTRAINT-02",
          "CONSTRAINT-03"
        ],
        "guarantees": [
          "Every ready criterion has a stable ID, scope/source relationship, conditions or explicit applicability, guarantees and a verification oracle.",
          "An unresolved blocking decision prevents readiness; missing meaning is reported, never generated.",
          "Typed intent/problem/caller/outcome and approach records are required at readiness; sources may be local/user requests and baseline commit may be null for an unborn repository.",
          "A partially written criterion/task is structurally storable without invented placeholders. Readiness reports missing scenarios, oracle or applicability by symbol."
        ],
        "id": "AC-002",
        "intent_refs": [
          "SCOPE-01",
          "SCOPE-02"
        ],
        "kind": "behavior",
        "obligation": "must",
        "preconditions": [
          "A supported spec model is supplied."
        ],
        "scenarios": [
          {
            "given": "A well-formed draft with no criteria.",
            "id": "SCN-002-01",
            "then": "Structural succeeds; ready reports missing criteria.",
            "when": "Validate structural, then ready."
          },
          {
            "given": "A criterion has no oracle, or a core decision is unresolved.",
            "id": "SCN-002-02",
            "then": "NOT_READY lists exact symbols and missing fields.",
            "when": "Validate ready."
          },
          {
            "given": "A draft criterion has only ID/title/statement; a local user request has no URL and the repository has no commit.",
            "id": "SCN-002-03",
            "then": "Structural succeeds; ready identifies only the missing contract fields and does not invent a commit or public source.",
            "when": "Validate structural and ready."
          }
        ],
        "source_refs": [
          "SRC-01",
          "SRC-15",
          "SRC-16",
          "SRC-17"
        ],
        "statement": "When validating a specification for readiness, the engine shall require observable contract records and explicit intent relationships while allowing incomplete structural drafts.",
        "title": "Explicit spec contracts and honest drafts",
        "trigger": "Validate at structural or ready gate.",
        "verification": {
          "evidence_state": "planned",
          "id": "VER-002",
          "method": "automated_and_review",
          "negative_control": "A generic “works correctly” assertion without an observable oracle must fail review, even if structurally present.",
          "oracle": "Readiness fixtures distinguish missing, empty and inapplicable fields and expose exact diagnostics.",
          "planned_target": "TestSpecReadiness"
        }
      },
      {
        "applicability": {
          "mode": "conditional",
          "rationale": "The trigger and stated conditions delimit this obligation; input validation and failure behavior remain part of the contract where applicable."
        },
        "constraint_refs": [
          "CONSTRAINT-01",
          "CONSTRAINT-02",
          "CONSTRAINT-03"
        ],
        "guarantees": [
          "Each task has exact scoped paths, a verification definition, at least one criterion and explicit dependencies.",
          "Every active must criterion is advanced by a task; every task advances a criterion. Many-to-many mappings are permitted.",
          "Unknown IDs, cycles, duplicate task IDs and missing bindings fail validation.",
          "Checkpoints partition tasks, have explicit dependency order, and contain no dependency on a later checkpoint.",
          "Every active should/may criterion is either covered or given one explicit disposition and rationale; unknown or must-criterion omissions block readiness."
        ],
        "id": "AC-003",
        "intent_refs": [
          "SCOPE-01",
          "SCOPE-02"
        ],
        "kind": "behavior",
        "obligation": "must",
        "preconditions": [
          "A plan and its target spec can be read."
        ],
        "scenarios": [
          {
            "given": "Two tasks cover one criterion, and one task covers two criteria.",
            "id": "SCN-003-01",
            "then": "Valid bidirectional coverage; no false one-to-one constraint.",
            "when": "Validate coverage."
          },
          {
            "given": "One task cites AC-999 or depends on itself.",
            "id": "SCN-003-02",
            "then": "The diagnostic names the unresolved ref or cycle.",
            "when": "Validate graph and references."
          },
          {
            "given": "A task in CP-01 depends on a task in CP-02.",
            "id": "SCN-003-03",